{
  "actors": [],
  "aggregates": [],
  "bytes": [],
  "closures": [],
  "compiler_version": "hew-wasm-0.6.0",
  "entry": {
    "exit": "unit",
    "function": 0
  },
  "externs": [],
  "functions": [
    {
      "blocks": [
        {
          "id": 0,
          "ops": [
            {
              "dst": 0,
              "op": "const.str",
              "own": "owned",
              "span": {
                "end": 22,
                "start": 22
              },
              "str": 0
            }
          ],
          "params": [],
          "term": {
            "assertion": null,
            "cleanup": {
              "args": [],
              "to": 1
            },
            "message": {
              "decision": "borrow",
              "value": 0
            },
            "op": "panic",
            "span": {
              "end": 22,
              "start": 22
            }
          }
        },
        {
          "id": 1,
          "ops": [],
          "params": [],
          "term": {
            "edge": {
              "args": [],
              "to": 4
            },
            "op": "goto",
            "span": {
              "end": 22,
              "start": 22
            }
          }
        },
        {
          "id": 2,
          "ops": [],
          "params": [],
          "term": {
            "op": "resume_unwind",
            "span": null
          }
        },
        {
          "id": 3,
          "ops": [
            {
              "dst": null,
              "op": "destroy_value",
              "span": null,
              "value": 0
            }
          ],
          "params": [],
          "term": {
            "edge": {
              "args": [],
              "to": 2
            },
            "op": "goto",
            "span": null
          }
        },
        {
          "id": 4,
          "ops": [],
          "params": [],
          "term": {
            "edge": {
              "args": [],
              "to": 5
            },
            "op": "goto",
            "span": null
          }
        },
        {
          "id": 5,
          "ops": [],
          "params": [],
          "term": {
            "edge": {
              "args": [],
              "to": 3
            },
            "op": "goto",
            "span": null
          }
        }
      ],
      "entry": 0,
      "id": 0,
      "name": "__hew_fn_main",
      "params": [],
      "places": []
    }
  ],
  "hew_version": "0.6.0",
  "profile": "sandbox.sandbox-vm-export.v0",
  "regex_patterns": [],
  "resources": [],
  "runtime_families": [],
  "schema_version": "hew.sandbox.bytecode.v1",
  "strings": [
    "sandbox panic"
  ],
  "structural_render": [],
  "supervisors": [],
  "suspend_kinds": [],
  "value_capabilities": [],
  "variants": [],
  "vtables": []
}
