{
  "actors": [],
  "aggregates": [],
  "bytes": [],
  "closures": [],
  "compiler_version": "hew-wasm-0.6.1",
  "entry": {
    "exit": "unit",
    "function": 0
  },
  "externs": [],
  "functions": [
    {
      "blocks": [
        {
          "id": 0,
          "ops": [
            {
              "dst": 0,
              "op": "const.int",
              "own": "none",
              "span": {
                "end": 34,
                "start": 34
              },
              "ty": "i64",
              "value": "0"
            },
            {
              "dst": 1,
              "op": "const.int",
              "own": "none",
              "span": {
                "end": 49,
                "start": 49
              },
              "ty": "i64",
              "value": "1"
            }
          ],
          "params": [],
          "term": {
            "binary_op": "Divide",
            "failures": [
              {
                "edge": {
                  "args": [],
                  "to": 2
                },
                "trap": "divide_by_zero"
              },
              {
                "edge": {
                  "args": [],
                  "to": 3
                },
                "trap": "integer_overflow"
              }
            ],
            "lhs": 1,
            "normal": {
              "args": [
                2
              ],
              "to": 1
            },
            "op": "checked.binary",
            "result": {
              "own": "none",
              "value": 2
            },
            "rhs": 0,
            "span": {
              "end": 53,
              "start": 53
            },
            "ty": "i64"
          }
        },
        {
          "id": 1,
          "ops": [],
          "params": [
            {
              "own": "none",
              "value": 3
            }
          ],
          "term": {
            "args": [
              {
                "decision": "copy",
                "value": 3
              }
            ],
            "callbacks": [],
            "family": 0,
            "normal": {
              "args": [],
              "to": 9
            },
            "op": "runtime.call",
            "releases_contents": false,
            "result": null,
            "result_member_shapes": [],
            "result_shape": null,
            "span": {
              "end": 49,
              "start": 49
            },
            "structural": null,
            "unwind": null
          }
        },
        {
          "id": 2,
          "ops": [],
          "params": [],
          "term": {
            "cleanup": {
              "args": [],
              "to": 4
            },
            "op": "checked_raise",
            "span": {
              "end": 53,
              "start": 53
            },
            "trap": "divide_by_zero"
          }
        },
        {
          "id": 3,
          "ops": [],
          "params": [],
          "term": {
            "cleanup": {
              "args": [],
              "to": 8
            },
            "op": "checked_raise",
            "span": {
              "end": 53,
              "start": 53
            },
            "trap": "integer_overflow"
          }
        },
        {
          "id": 4,
          "ops": [],
          "params": [],
          "term": {
            "edge": {
              "args": [],
              "to": 6
            },
            "op": "goto",
            "span": {
              "end": 53,
              "start": 53
            }
          }
        },
        {
          "id": 5,
          "ops": [],
          "params": [],
          "term": {
            "op": "resume_unwind",
            "span": null
          }
        },
        {
          "id": 6,
          "ops": [],
          "params": [],
          "term": {
            "edge": {
              "args": [],
              "to": 7
            },
            "op": "goto",
            "span": null
          }
        },
        {
          "id": 7,
          "ops": [],
          "params": [],
          "term": {
            "edge": {
              "args": [],
              "to": 5
            },
            "op": "goto",
            "span": null
          }
        },
        {
          "id": 8,
          "ops": [],
          "params": [],
          "term": {
            "edge": {
              "args": [],
              "to": 6
            },
            "op": "goto",
            "span": {
              "end": 53,
              "start": 53
            }
          }
        },
        {
          "id": 9,
          "ops": [],
          "params": [],
          "term": {
            "edge": {
              "args": [],
              "to": 10
            },
            "op": "goto",
            "span": {
              "end": 49,
              "start": 49
            }
          }
        },
        {
          "id": 10,
          "ops": [],
          "params": [],
          "term": {
            "op": "return",
            "span": {
              "end": 49,
              "start": 49
            },
            "value": null
          }
        }
      ],
      "entry": 0,
      "id": 0,
      "name": "__hew_fn_main",
      "params": [],
      "places": []
    }
  ],
  "hew_version": "0.6.1",
  "profile": "sandbox.sandbox-vm-export.v0",
  "regex_patterns": [],
  "resources": [],
  "runtime_families": [
    {
      "detail": {
        "kind": "I64",
        "newline": true
      },
      "family": "Print",
      "id": 0
    }
  ],
  "schema_version": "hew.sandbox.bytecode.v1",
  "strings": [],
  "structural_render": [],
  "supervisors": [],
  "suspend_kinds": [],
  "value_capabilities": [],
  "variants": [],
  "vtables": []
}
