{
  "actors": [],
  "aggregates": [],
  "bytes": [],
  "closures": [],
  "compiler_version": "hew-wasm-0.6.0",
  "entry": {
    "exit": "unit",
    "function": 0
  },
  "externs": [],
  "functions": [
    {
      "blocks": [
        {
          "id": 0,
          "ops": [
            {
              "dst": 0,
              "op": "const.int",
              "own": "none",
              "span": {
                "end": 29,
                "start": 29
              },
              "ty": "i64",
              "value": "9007199254740993"
            },
            {
              "dst": 1,
              "op": "const.int",
              "own": "none",
              "span": {
                "end": 63,
                "start": 63
              },
              "ty": "i64",
              "value": "1"
            }
          ],
          "params": [],
          "term": {
            "binary_op": "Add",
            "failures": [
              {
                "edge": {
                  "args": [],
                  "to": 2
                },
                "trap": "integer_overflow"
              }
            ],
            "lhs": 0,
            "normal": {
              "args": [
                2
              ],
              "to": 1
            },
            "op": "checked.binary",
            "result": {
              "own": "none",
              "value": 2
            },
            "rhs": 1,
            "span": {
              "end": 63,
              "start": 63
            },
            "ty": "i64"
          }
        },
        {
          "id": 1,
          "ops": [],
          "params": [
            {
              "own": "none",
              "value": 3
            }
          ],
          "term": {
            "args": [
              {
                "decision": "copy",
                "value": 3
              }
            ],
            "callbacks": [],
            "family": 0,
            "normal": {
              "args": [],
              "to": 7
            },
            "op": "runtime.call",
            "releases_contents": false,
            "result": null,
            "result_member_shapes": [],
            "result_shape": null,
            "span": {
              "end": 70,
              "start": 70
            },
            "structural": null,
            "unwind": null
          }
        },
        {
          "id": 2,
          "ops": [],
          "params": [],
          "term": {
            "cleanup": {
              "args": [],
              "to": 3
            },
            "op": "checked_raise",
            "span": {
              "end": 63,
              "start": 63
            },
            "trap": "integer_overflow"
          }
        },
        {
          "id": 3,
          "ops": [],
          "params": [],
          "term": {
            "edge": {
              "args": [],
              "to": 5
            },
            "op": "goto",
            "span": {
              "end": 63,
              "start": 63
            }
          }
        },
        {
          "id": 4,
          "ops": [],
          "params": [],
          "term": {
            "op": "resume_unwind",
            "span": null
          }
        },
        {
          "id": 5,
          "ops": [],
          "params": [],
          "term": {
            "edge": {
              "args": [],
              "to": 6
            },
            "op": "goto",
            "span": null
          }
        },
        {
          "id": 6,
          "ops": [],
          "params": [],
          "term": {
            "edge": {
              "args": [],
              "to": 4
            },
            "op": "goto",
            "span": null
          }
        },
        {
          "id": 7,
          "ops": [
            {
              "dst": 4,
              "op": "const.int",
              "own": "none",
              "span": {
                "end": 94,
                "start": 94
              },
              "ty": "i64",
              "value": "9007199254740994"
            },
            {
              "binary_op": "Equal",
              "dst": 5,
              "lhs": 3,
              "op": "binary",
              "own": "none",
              "rhs": 4,
              "span": {
                "end": 89,
                "start": 89
              },
              "ty": "i64"
            }
          ],
          "params": [],
          "term": {
            "condition": 5,
            "else": {
              "args": [],
              "to": 9
            },
            "op": "branch",
            "span": {
              "end": 89,
              "start": 89
            },
            "then": {
              "args": [],
              "to": 8
            }
          }
        },
        {
          "id": 8,
          "ops": [
            {
              "dst": 6,
              "op": "const.str",
              "own": "owned",
              "span": {
                "end": 129,
                "start": 129
              },
              "str": 0
            }
          ],
          "params": [],
          "term": {
            "args": [
              {
                "decision": "borrow",
                "value": 6
              }
            ],
            "callbacks": [],
            "family": 1,
            "normal": {
              "args": [],
              "to": 10
            },
            "op": "runtime.call",
            "releases_contents": false,
            "result": null,
            "result_member_shapes": [],
            "result_shape": null,
            "span": {
              "end": 129,
              "start": 129
            },
            "structural": null,
            "unwind": null
          }
        },
        {
          "id": 9,
          "ops": [],
          "params": [],
          "term": {
            "edge": {
              "args": [],
              "to": 11
            },
            "op": "goto",
            "span": {
              "end": 89,
              "start": 89
            }
          }
        },
        {
          "id": 10,
          "ops": [
            {
              "dst": null,
              "op": "destroy_value",
              "span": null,
              "value": 6
            }
          ],
          "params": [],
          "term": {
            "edge": {
              "args": [],
              "to": 11
            },
            "op": "goto",
            "span": {
              "end": 129,
              "start": 129
            }
          }
        },
        {
          "id": 11,
          "ops": [],
          "params": [],
          "term": {
            "edge": {
              "args": [],
              "to": 12
            },
            "op": "goto",
            "span": {
              "end": 129,
              "start": 129
            }
          }
        },
        {
          "id": 12,
          "ops": [],
          "params": [],
          "term": {
            "op": "return",
            "span": {
              "end": 129,
              "start": 129
            },
            "value": null
          }
        }
      ],
      "entry": 0,
      "id": 0,
      "name": "__hew_fn_main",
      "params": [],
      "places": []
    }
  ],
  "hew_version": "0.6.0",
  "profile": "sandbox.sandbox-vm-export.v0",
  "regex_patterns": [],
  "resources": [],
  "runtime_families": [
    {
      "detail": {
        "kind": "I64",
        "newline": true
      },
      "family": "Print",
      "id": 0
    },
    {
      "detail": {
        "kind": "Str",
        "newline": true
      },
      "family": "Print",
      "id": 1
    }
  ],
  "schema_version": "hew.sandbox.bytecode.v1",
  "strings": [
    "matched"
  ],
  "structural_render": [],
  "supervisors": [],
  "suspend_kinds": [],
  "value_capabilities": [],
  "variants": [],
  "vtables": []
}
