{
  "actors": [],
  "aggregates": [],
  "bytes": [],
  "closures": [],
  "compiler_version": "hew-wasm-0.6.0",
  "entry": {
    "exit": "unit",
    "function": 0
  },
  "externs": [],
  "functions": [
    {
      "blocks": [
        {
          "id": 0,
          "ops": [
            {
              "dst": 0,
              "op": "const.int",
              "own": "none",
              "span": {
                "end": 66,
                "start": 66
              },
              "ty": "i64",
              "value": "42"
            }
          ],
          "params": [],
          "term": {
            "args": [
              {
                "decision": "copy",
                "value": 0
              }
            ],
            "callee": 1,
            "normal": {
              "args": [
                1
              ],
              "to": 1
            },
            "op": "call",
            "result": {
              "own": "none",
              "value": 1
            },
            "span": {
              "end": 66,
              "start": 66
            },
            "unwind": {
              "args": [],
              "to": 2
            }
          }
        },
        {
          "id": 1,
          "ops": [],
          "params": [
            {
              "own": "none",
              "value": 2
            }
          ],
          "term": {
            "args": [
              {
                "decision": "copy",
                "value": 2
              }
            ],
            "callbacks": [],
            "family": 0,
            "normal": {
              "args": [],
              "to": 6
            },
            "op": "runtime.call",
            "releases_contents": false,
            "result": null,
            "result_member_shapes": [],
            "result_shape": null,
            "span": {
              "end": 63,
              "start": 63
            },
            "structural": null,
            "unwind": null
          }
        },
        {
          "id": 2,
          "ops": [],
          "params": [],
          "term": {
            "edge": {
              "args": [],
              "to": 4
            },
            "op": "goto",
            "span": {
              "end": 66,
              "start": 66
            }
          }
        },
        {
          "id": 3,
          "ops": [],
          "params": [],
          "term": {
            "op": "resume_unwind",
            "span": null
          }
        },
        {
          "id": 4,
          "ops": [],
          "params": [],
          "term": {
            "edge": {
              "args": [],
              "to": 5
            },
            "op": "goto",
            "span": null
          }
        },
        {
          "id": 5,
          "ops": [],
          "params": [],
          "term": {
            "edge": {
              "args": [],
              "to": 3
            },
            "op": "goto",
            "span": null
          }
        },
        {
          "id": 6,
          "ops": [],
          "params": [],
          "term": {
            "edge": {
              "args": [],
              "to": 7
            },
            "op": "goto",
            "span": {
              "end": 63,
              "start": 63
            }
          }
        },
        {
          "id": 7,
          "ops": [],
          "params": [],
          "term": {
            "op": "return",
            "span": {
              "end": 63,
              "start": 63
            },
            "value": null
          }
        }
      ],
      "entry": 0,
      "id": 0,
      "name": "__hew_fn_main",
      "params": [],
      "places": []
    },
    {
      "blocks": [
        {
          "id": 0,
          "ops": [],
          "params": [],
          "term": {
            "edge": {
              "args": [],
              "to": 1
            },
            "op": "goto",
            "span": {
              "end": 30,
              "start": 30
            }
          }
        },
        {
          "id": 1,
          "ops": [],
          "params": [],
          "term": {
            "op": "return",
            "span": {
              "end": 30,
              "start": 30
            },
            "value": {
              "decision": "move",
              "value": 0
            }
          }
        }
      ],
      "entry": 0,
      "id": 1,
      "name": "__hew_fn_id$$i64",
      "params": [
        {
          "own": "none",
          "value": 0
        }
      ],
      "places": []
    }
  ],
  "hew_version": "0.6.0",
  "profile": "sandbox.sandbox-vm-export.v0",
  "regex_patterns": [],
  "resources": [],
  "runtime_families": [
    {
      "detail": {
        "kind": "I64",
        "newline": true
      },
      "family": "Print",
      "id": 0
    }
  ],
  "schema_version": "hew.sandbox.bytecode.v1",
  "strings": [],
  "structural_render": [],
  "supervisors": [],
  "suspend_kinds": [],
  "value_capabilities": [],
  "variants": [],
  "vtables": []
}
